conference_id;name;publication
1132202845;International Conference on Informatics in Control, Automation and Robotics;International Conference on Informatics in Control, Automation and Robotics 2 2004
1177184315;European Conference on Object-Oriented Programming;European Conference on Object-Oriented Programming 7313 2012
1196868077;International Conference on Computer Vision and Graphics;International Conference on Computer Vision and Graphics 32 2006
2754610831;International Conference on Wireless Mobile Communication and Healthcare;International Conference on Wireless Mobile Communication and Healthcare 61 2012
1145073645;Theory and Applications of Satisfiability Testing;Theory and Applications of Satisfiability Testing 7317 2012
1177825390;Ad-Hoc, Mobile and Wireless Networks;Ad-Hoc, Mobile and Wireless Networks 8487 2014
2755765245;International Conference: Beyond Databases, Architectures and Structures;International Conference: Beyond Databases, Architectures and Structures 424 2014
2754015709;International Conference on Stabilization, Safety, and Security of Distributed Systems;International Conference on Stabilization, Safety, and Security of Distributed Systems 6976 2011
1196552754;International Conference on Social Computing;International Conference on Social Computing 8531 2014
1171774888;International Conference on Information Security and Cryptology;International Conference on Information Security and Cryptology 7839 2012
1171805742;Americas Conference on Information Systems;Americas Conference on Information Systems 5 2012
1135342153;The Web Conference;The Web Conference 6 2013
1137516283;Advances in Databases and Information Systems;Advances in Databases and Information Systems 6909 2011
1177622950;Conference on Learning Theory;Conference on Learning Theory 2777 2003
1163725243;British National Conference on Databases;British National Conference on Databases 6121 2010
1135668280;International Conference on Information and Communication Security;International Conference on Information and Communication Security 7043 2011
2759197562;Industrial Conference on Data Mining;Industrial Conference on Data Mining 6870 2011
2758979576;User Centric Media;User Centric Media 60 2010
1173521070;Web-Age Information Management;Web-Age Information Management 7932 2013
1180700458;Portuguese Conference on Artificial Intelligence;Portuguese Conference on Artificial Intelligence 7026 2011
2755175125;International Conference on Cross-Cultural Design;International Conference on Cross-Cultural Design 8528 2014
1180801733;Next Generation Teletraffic and Wired/Wireless Advanced Networking;Next Generation Teletraffic and Wired/Wireless Advanced Networking 6869 2011
2756384364;International Conference on Network of Future;International Conference on Network of Future 327 2010
1141854641;High Performance Distributed Computing;High Performance Distributed Computing 11 1997
1187155619;Similarity Search and Applications;Similarity Search and Applications 8821 2014
2755765213;International Conference on Multiple Classifier Systems;International Conference on Multiple Classifier Systems 6713 2011
2754027934;International Conference on Artificial Intelligence in Theory and Practice;International Conference on Artificial Intelligence in Theory and Practice 331 2010
2626725751;European Software Engineering Conference;European Software Engineering Conference 287 1989
2760727739;Serious Games Development and Applications;Serious Games Development and Applications 1 2014
1166012910;Computer Algebra in Scientific Computing;Computer Algebra in Scientific Computing 8136 2013
1163163559;International Conference on Image Processing;International Conference on Image Processing 233 2014
1133523790;Very Large Data Bases;Very Large Data Bases 7 2014
2756222420;International Conference on Distributed, Ambient, and Pervasive Interactions;International Conference on Distributed, Ambient, and Pervasive Interactions 8028 2013
2759666259;Algebraic and Numeric Biology;Algebraic and Numeric Biology 6479 2010
2755590033;International Conference on Progress in Cultural Heritage Preservation;International Conference on Progress in Cultural Heritage Preservation 7616 2012
1121756369;Haifa Verification Conference;Haifa Verification Conference 8855 2014
1143279144;Intelligent Robots and Systems;Intelligent Robots and Systems 2012 2012
1169379829;Requirements Engineering: Foundation for Software Quality;Requirements Engineering: Foundation for Software Quality 8396 2014
2758863647;Computational Intelligence in Security for Information Systems;Computational Intelligence in Security for Information Systems 53 2009
1171022770;International Conference on Model Transformation;International Conference on Model Transformation 7909 2013
2758387012;Forensics in Telecommunications, Information and Multimedia;Forensics in Telecommunications, Information and Multimedia 7 2010
1158252963;International Joint Conference on Knowledge Discovery, Knowledge Engineering and Knowledge Management;International Joint Conference on Knowledge Discovery, Knowledge Engineering and Knowledge Management 348 2011
1144482763;Energy Minimization Methods in Computer Vision and Pattern Recognition;Energy Minimization Methods in Computer Vision and Pattern Recognition 8932 2015
1198121106;Recent Advances in Intrusion Detection;Recent Advances in Intrusion Detection 7462 2012
2758297524;Digital Games Research Association;Digital Games Research Association 6 2011
1136691831;International Conference on Supercomputing;International Conference on Supercomputing 8488 2014
1144845270;Spring Simulation Multiconference;Spring Simulation Multiconference 44 2012
1168542559;Data and Knowledge Engineering;Data and Knowledge Engineering 5 1990
2754238509;International Conference on Entertainment Computing;International Conference on Entertainment Computing 6972 2011
1185914153;Frontiers of Combining Systems;Frontiers of Combining Systems 8152 2013
2898139291;International conference natural language processing;International conference natural language processing 6716 2011
2757936393;International Conference on Testing Software and Systems;International Conference on Testing Software and Systems 8254 2013
1131605622;International Conference on Pattern Recognition;International Conference on Pattern Recognition 6388 2010
1145706541;International Conference on Concurrency Theory;International Conference on Concurrency Theory 6901 2011
1189246982;European Conference on Symbolic and Quantitative Approaches to Reasoning and Uncertainty;European Conference on Symbolic and Quantitative Approaches to Reasoning and Uncertainty 7958 2013
2706111989;International Conference on Computational Science;International Conference on Computational Science 2659 2003
1121493235;Artificial Intelligence: Methodology, Systems, Applications;Artificial Intelligence: Methodology, Systems, Applications 8722 2014
1138950671;OWL: Experiences and Directions;OWL: Experiences and Directions 258 2007
1124356716;Computational Methods in Systems Biology;Computational Methods in Systems Biology 8130 2013
2759715976;Monterey conference on Large-Scale Complex IT Systems: development, operation and management;Monterey conference on Large-Scale Complex IT Systems: development, operation and management 7539 2012
1133530880;International Conference in Central Europe on Computer Graphics and Visualization;International Conference in Central Europe on Computer Graphics and Visualization 13 2005
2754737367;International Conference on Breast Imaging;International Conference on Breast Imaging 7361 2012
1124396182;Hellenic Conference on Artificial Intelligence;Hellenic Conference on Artificial Intelligence 8445 2014
1184093072;Integer Programming and Combinatorial Optimization;Integer Programming and Combinatorial Optimization 7801 2013
2755952065;International Conference on Critical Infrastructure Protection;International Conference on Critical Infrastructure Protection 441 2014
2760079786;International Workshop on Combinatorial Algorithms;International Workshop on Combinatorial Algorithms 8288 2013
1172556315;International Conference on Biometrics;International Conference on Biometrics 3832 2006
1157056623;Data Integration in the Life Sciences;Data Integration in the Life Sciences 8574 2014
1129447984;Computer Supported Cooperative Work in Design;Computer Supported Cooperative Work in Design 7 2003
2756594110;Intelligent Autonomous Systems;Intelligent Autonomous Systems 194 2013
1179814642;International Workshop on OpenMP;International Workshop on OpenMP 6665 2011
1159170270;IEEE International Conference on Cloud Computing Technology and Science;IEEE International Conference on Cloud Computing Technology and Science 2010 2010
1156586875;Cross-Language Evaluation Forum;Cross-Language Evaluation Forum 8685 2014
1177006722;Modeling Decisions for Artificial Intelligence;Modeling Decisions for Artificial Intelligence 8825 2014
2754410523;International Conference on Computers for Handicapped Persons;International Conference on Computers for Handicapped Persons 113 2014
1201479284;Canadian Conference on Computational Geometry;Canadian Conference on Computational Geometry 26 1996
1179516875;Summer Computer Simulation Conference;Summer Computer Simulation Conference 45 2013
2755808122;Ibero-American Conference on Artificial Intelligence;Ibero-American Conference on Artificial Intelligence 8864 2014
1160211978;Applied Cryptography and Network Security;Applied Cryptography and Network Security 7954 2013
2754545791;European Society for Fuzzy Logic and Technology Conference;European Society for Fuzzy Logic and Technology Conference 2 2009
2753994491;International conference on Artificial intelligence and applications;International conference on Artificial intelligence and applications 381 2012
1181770344;Intelligent Technologies for Interactive Entertainment;Intelligent Technologies for Interactive Entertainment 124 2013
1168175394;Logic-based Program Synthesis and Transformation;Logic-based Program Synthesis and Transformation 4915 2008
1152238068;Business Process Management;Business Process Management 74 2013
1163618098;IEEE Symposium on Security and Privacy;IEEE Symposium on Security and Privacy 1 2003
1198399583;Trustworthy Global Computing;Trustworthy Global Computing 8358 2013
1173972131;International Conference on Mobile and Ubiquitous Systems: Networking and Services;International Conference on Mobile and Ubiquitous Systems: Networking and Services 73 2010
2760504002;Utility and Cloud Computing;Utility and Cloud Computing 32 2009
2622833876;International Conference on Information Technology;International Conference on Information Technology 7451 2012
1129075963;Human-Robot Interaction;Human-Robot Interaction 4 2012
1123496967;Foundations of Software Technology and Theoretical Computer Science;Foundations of Software Technology and Theoretical Computer Science 405 1989
1175805213;Information Hiding;Information Hiding 6958 2011
1174915412;Electronic Commerce;Electronic Commerce 3 2015
1130451194;International Conference on Communications;International Conference on Communications 7394 2012
2625302465;Advances in Computer Entertainment Technology;Advances in Computer Entertainment Technology 7624 2012
2757853818;European Conference on Service-Oriented and Cloud Computing;European Conference on Service-Oriented and Cloud Computing 393 2013
2754148693;International Conference on Embedded Computer Systems: Architectures, Modeling, and Simulation;International Conference on Embedded Computer Systems: Architectures, Modeling, and Simulation 4599 2007
1176669504;Formal Methods for Industrial Critical Systems;Formal Methods for Industrial Critical Systems 6959 2011
1186529236;Australasian Database Conference;Australasian Database Conference 115 2011
2755928763;European Conference on Information Literacy;European Conference on Information Literacy 492 2014
1135538937;International Conference on Pervasive Computing;International Conference on Pervasive Computing 4480 2007
1142153833;European Conference on Genetic Programming;European Conference on Genetic Programming 7831 2013
1194858622;Computational Intelligence Methods for Bioinformatics and Biostatistics;Computational Intelligence Methods for Bioinformatics and Biostatistics 6685 2010
1130695903;Artificial General Intelligence;Artificial General Intelligence 7999 2013
1165826640;International Conference on Wireless Networks;International Conference on Wireless Networks 2008 2008
1161181142;Computer Games;Computer Games 504 2014
2756643752;Model and Data Engineering;Model and Data Engineering 7602 2012
2758852442;Health Information Science;Health Information Science 7798 2013
2532200668;Symposium on Large Spatial Databases;Symposium on Large Spatial Databases 5644 2009
2755014101;International Conference on HCI in Business;International Conference on HCI in Business 8527 2014
1122647587;Biologically Inspired Cognitive Architectures;Biologically Inspired Cognitive Architectures 221 2010
1195874795;Intelligent Agents;Intelligent Agents 155 2012
1191474766;Field-Programmable Logic and Applications;Field-Programmable Logic and Applications 2778 2003
2758803293;Intelligent Distributed Computing;Intelligent Distributed Computing 5 2011
2754141368;International Conference on Lightning Protection;International Conference on Lightning Protection 7 2010
1152239011;Agents and Data Mining Interaction;Agents and Data Mining Interaction 8316 2013
1192093291;Testbeds and Research Infrastructures for the DEvelopment of NeTworks and COMmunities;Testbeds and Research Infrastructures for the DEvelopment of NeTworks and COMmunities 2 2015
2759465893;Conference on Electronic voting technology/workshop on trustworthy elections;Conference on Electronic voting technology/workshop on trustworthy elections 2009 2009
1140000399;Genetic and Evolutionary Computation Conference;Genetic and Evolutionary Computation Conference 1 1999
2759033409;International Network Optimization Conference;International Network Optimization Conference 6701 2011
1159958186;Distributed Computing in Sensor Systems;Distributed Computing in Sensor Systems 3560 2005
2898391823;International Workshop Algorithmic Foundations Robotics;International Workshop Algorithmic Foundations Robotics 86 2013
1137528458;Theory of Cryptography Conference;Theory of Cryptography Conference 8349 2014
2755571638;EvoWorkshops on Applications of Evolutionary Computing;EvoWorkshops on Applications of Evolutionary Computing 2037 2001
2760587233;Human-Computer Interaction, Tourism and Cultural Heritage;Human-Computer Interaction, Tourism and Cultural Heritage 7546 2011
1149998698;Workshop on Algorithms and Data Structures;Workshop on Algorithms and Data Structures 6844 2011
2754982483;World Conference on WWW and Internet;World Conference on WWW and Internet 1999 1999
2760443345;Mathematical and Engineering Methods in Computer Science;Mathematical and Engineering Methods in Computer Science 8934 2014
2754905231;International Conference on Future Generation Communication and Networking;International Conference on Future Generation Communication and Networking 265 2011
1200368810;International Conference on Security and Cryptography;International Conference on Security and Cryptography 2008 2008
2754489101;International Conference on Internet Computing;International Conference on Internet Computing 2 2003
2754869338;International Conference on 3D Vision;International Conference on 3D Vision 2 2014
1160077527;Verified Software: Theories, Tools, Experiments;Verified Software: Theories, Tools, Experiments 8164 2013
2756058035;International Symposium on Artificial Intelligence;International Symposium on Artificial Intelligence 6797 2010
2754569583;European conference on Evolutionary Computation in Combinatorial Optimization;European conference on Evolutionary Computation in Combinatorial Optimization 7832 2013
2754524264;IFIP Conference on System Modeling and Optimization;IFIP Conference on System Modeling and Optimization 443 2013
1183637428;Pacific Symposium on Biocomputing;Pacific Symposium on Biocomputing 19 2013
1135455702;Trust and Trustworthy Computing;Trust and Trustworthy Computing 7904 2013
1128239323;Information Processing and Management of Uncertainty;Information Processing and Management of Uncertainty 6178 2010
2759836497;Practice-Driven Research on Enterprise Transformation;Practice-Driven Research on Enterprise Transformation 151 2013
2621606475;International Teletraffic Congress;International Teletraffic Congress 4516 2007
1184151122;Symposium on Principles of Database Systems;Symposium on Principles of Database Systems 16 1997
1165196434;International Conference on Intelligent Robotics and Applications;International Conference on Intelligent Robotics and Applications 7101 2011
2754602532;International Conference of Learning Sciences;International Conference of Learning Sciences 1 2010
1185151044;Canadian Conference on Artificial Intelligence;Canadian Conference on Artificial Intelligence 6657 2011
2754720008;International Symposium on Parameterized and Exact Computation;International Symposium on Parameterized and Exact Computation 7535 2012
1143040027;The Practice of Enterprise Modeling;The Practice of Enterprise Modeling 197 2014
2754624328;International Conference on Move to Meaningful Internet Systems;International Conference on Move to Meaningful Internet Systems 7046 2011
2898166392;International Conference Industrial, Engineering & Other Applications Applied Intelligent Systems;International Conference Industrial, Engineering & Other Applications Applied Intelligent Systems 9101 2015
1180270854;International Workshop on Combinatorial Image Analysis;International Workshop on Combinatorial Image Analysis 7655 2012
1173173816;Formal Techniques for (Networked and) Distributed Systems;Formal Techniques for (Networked and) Distributed Systems 2767 2003
1181233964;Wearable and Implantable Body Sensor Networks;Wearable and Implantable Body Sensor Networks 13 2007
1174458453;Information Security Practice and Experience;Information Security Practice and Experience 8434 2014
2760652811;Formal Aspects of Component Software;Formal Aspects of Component Software 8348 2013
1157343637;Multi-Agent Systems and Agent-Based Simulation;Multi-Agent Systems and Agent-Based Simulation 9002 2014
1137878512;International Conference on Conceptual Structures;International Conference on Conceptual Structures 8577 2014
1176077016;International Conference / Workshop on Embedded Computer Systems: Architectures, Modeling and Simulation;International Conference / Workshop on Embedded Computer Systems: Architectures, Modeling and Simulation 3133 2004
1196848493;Digital Information and Communication Technology and Its Applications;Digital Information and Communication Technology and Its Applications 166 2011
2758344833;Radio Frequency Identification: Security and Privacy Issues;Radio Frequency Identification: Security and Privacy Issues 8262 2013
2898559085;International Workshop Constructive Side-Channel Analysis and Secure Design;International Workshop Constructive Side-Channel Analysis and Secure Design 7275 2012
1169721244;Computer Assisted Radiology and Surgery;Computer Assisted Radiology and Surgery 7 2012
2755952865;Science and Information Conference;Science and Information Conference 1 2019
2755561061;International Symposium on Security in Computing and Communication;International Symposium on Security in Computing and Communication 467 2014
1179772154;International Conference on Computer Vision Theory and Applications;International Conference on Computer Vision Theory and Applications 2 2010
1163117144;International Conference on Smart Grids and Green IT Systems;International Conference on Smart Grids and Green IT Systems 1 2012
2754206675;International Workshop on Robot Motion and Control;International Workshop on Robot Motion and Control 360 2007
1174839472;Cooperative Design, Visualization, and Engineering;Cooperative Design, Visualization, and Engineering 8683 2014
2754966661;International Conference on Online Communities and Social Computing;International Conference on Online Communities and Social Computing 6778 2011
1200222865;International Conference on Distributed Computing Systems;International Conference on Distributed Computing Systems 8729 2014
1173897633;Privacy Enhancing Technologies;Privacy Enhancing Technologies 7981 2013
1129724978;Swarm, Evolutionary, and Memetic Computing;Swarm, Evolutionary, and Memetic Computing 7076 2011
1196984251;Information and Communication Technologies in Tourism;Information and Communication Technologies in Tourism 28 2013
2755903644;International Conference on Information and Software Technologies;International Conference on Information and Software Technologies 403 2013
1145533764;European Conference on Interactive TV;European Conference on Interactive TV 5066 2008
1203258669;Workshop in Information Security Theory and Practice;Workshop in Information Security Theory and Practice 8501 2014
1169828999;Parallel and Distributed Computing: Applications and Technologies;Parallel and Distributed Computing: Applications and Technologies 3320 2004
2755540534;International Conference on Internationalization, Design and Global Development;International Conference on Internationalization, Design and Global Development 6775 2011
1165606533;Software Language Engineering;Software Language Engineering 8225 2013
2756630716;International Conference on the Theory of Information Retrieval;International Conference on the Theory of Information Retrieval 6931 2011
2754123984;International Workshop on DNA-Based Computers;International Workshop on DNA-Based Computers 8727 2014
1171169701;Discourse Anaphora and Anaphor Resolution Colloquium;Discourse Anaphora and Anaphor Resolution Colloquium 7099 2011
1155015387;Web Information Systems Modeling;Web Information Systems Modeling 6987 2011
1140684652;International ACM SIGIR Conference on Research and Development in Information Retrieval;International ACM SIGIR Conference on Research and Development in Information Retrieval 512 2009
1200067787;Web Intelligence;Web Intelligence 5 2013
2755814139;European conference on Software Process Improvement;European conference on Software Process Improvement 301 2012
1160737320;Italian Information Retrieval Workshop;Italian Information Retrieval Workshop 704 2011
2898415891;International Conference Information Security Theory and Practice;International Conference Information Security Theory and Practice 7322 2012
1195800536;Parallel Computing;Parallel Computing 7134 2010
1144277514;International MultiConference of Engineers and Computer Scientists;International MultiConference of Engineers and Computer Scientists 33 2006
2758039986;Information and Communication on Technology for the Fight against Global Warming;Information and Communication on Technology for the Fight against Global Warming 6868 2011
1200413642;Theory and Applications of Models of Computation;Theory and Applications of Models of Computation 7876 2013
2757397767;Multi-disciplinary Trends in Artificial Intelligence;Multi-disciplinary Trends in Artificial Intelligence 7080 2011
2754041620;Pacific Asia Conference on Language, Information, and Computation;Pacific Asia Conference on Language, Information, and Computation 21 2007
1149945488;Conference on Image and Video Retrieval;Conference on Image and Video Retrieval 2728 2003
2755562801;International Conference on DNA Computing;International Conference on DNA Computing 8141 2013
2755940938;SOCO-CISIS-ICEUTE;SOCO-CISIS-ICEUTE 239 2014
1122019578;Business Modeling and Software Design;Business Modeling and Software Design 109 2011
2754290031;International Conference on Computers Helping People with Special Needs;International Conference on Computers Helping People with Special Needs 8547 2014
1130809216;International Colloquium on Grammatical Inference;International Colloquium on Grammatical Inference 34 2014
1183478919;International Conference on Data Mining;International Conference on Data Mining 4065 2006
1165815086;International Conference on E-learning and Games;International Conference on E-learning and Games 23 2011
1164009877;Pacific Asia Conference on Information Systems;Pacific Asia Conference on Information Systems 1 2007
2757278510;Trends in Enterprise Architecture Research;Trends in Enterprise Architecture Research 70 2010
1156693759;Innovative Applications of Artificial Intelligence;Innovative Applications of Artificial Intelligence 3 2008
2754653529;IFIP/IEEE International Conference on Very Large Scale Integration;IFIP/IEEE International Conference on Very Large Scale Integration 379 2011
2755785453;International Conference on Large-Scale Scientific Computing;International Conference on Large-Scale Scientific Computing 8353 2013
1185688730;Integrated Formal Methods;Integrated Formal Methods 7321 2012
2757403054;Soft Computing for Problem Solving;Soft Computing for Problem Solving 236 2014
1189659341;High Performance Computing for Computational Science (Vector and Parallel Processing);High Performance Computing for Computational Science (Vector and Parallel Processing) 5336 2008
1200343872;International Workshop on Digital Watermarking;International Workshop on Digital Watermarking 5703 2009
1122073392;Intelligence and Security Informatics;Intelligence and Security Informatics 3495 2005
2756301225;International Conference on Unconventional Computation;International Conference on Unconventional Computation 7445 2012
1194923781;Multiagent System Technologies;Multiagent System Technologies 6973 2011
1145019647;IEEE Virtual Reality Conference;IEEE Virtual Reality Conference 142 2009
