conference_id;name;publication
2755023647;International Conference on Human Interface and Management of Information;International Conference on Human Interface and Management of Information 8522 2014
2535638237;International Conference on the Theory and Application of Cryptology and Information Security;International Conference on the Theory and Application of Cryptology and Information Security 8270 2013
1173644570;Computer Information Systems and Industrial Management Applications;Computer Information Systems and Industrial Management Applications 7564 2012
1167275352;Formal Modeling and Analysis of Timed Systems;Formal Modeling and Analysis of Timed Systems 6919 2011
1133222229;Computational Color Imaging Workshop;Computational Color Imaging Workshop 9016 2015
1141159355;Doctoral Conference on Computing, Electrical and Industrial Systems;Doctoral Conference on Computing, Electrical and Industrial Systems 423 2014
2754194746;International Conference on Learning and Collaboration Technologies;International Conference on Learning and Collaboration Technologies 8524 2014
1148751172;Intelligent Data Engineering and Automated Learning;Intelligent Data Engineering and Automated Learning 7435 2012
1199802775;Information Retrieval Facility Conference;Information Retrieval Facility Conference 8201 2013
1168669760;Workshop on Functional and Constraint Logic Programming;Workshop on Functional and Constraint Logic Programming 6816 2011
2758520484;International Symposium on End-User Development;International Symposium on End-User Development 6654 2011
1128394114;Applications of Natural Language to Data Bases;Applications of Natural Language to Data Bases 7337 2012
1193787109;Parallel Problem Solving from Nature;Parallel Problem Solving from Nature 2439 2002
1132567130;Rough Sets and Knowledge Technology;Rough Sets and Knowledge Technology 8818 2014
2606870472;Financial Cryptography;Financial Cryptography 7398 2012
1136496851;Scandinavian Workshop on Algorithm Theory;Scandinavian Workshop on Algorithm Theory 80 2018
1194636961;International Workshop on Fuzzy Logic and Applications;International Workshop on Fuzzy Logic and Applications 1 2013
1197725624;Software Engineering for Resilient Systems;Software Engineering for Resilient Systems 8166 2013
1120869304;Iberoamerican Congress on Pattern Recognition;Iberoamerican Congress on Pattern Recognition 7042 2011
2754242139;International Conference on Knowledge-Based and Intelligent Information and Engineering Systems;International Conference on Knowledge-Based and Intelligent Information and Engineering Systems 6883 2011
1170686637;Robot Soccer World Cup;Robot Soccer World Cup 2019 2001
1123621769;Conference on Multimedia Modeling;Conference on Multimedia Modeling 7733 2013
1157264799;Australasian User Interface Conference;Australasian User Interface Conference 150 2014
2627069240;International Conference on Electronic Commerce;International Conference on Electronic Commerce 152 2013
2754677391;International Conference on Digital Human Modeling;International Conference on Digital Human Modeling 6777 2011
1180547793;Verification, Model Checking and Abstract Interpretation;Verification, Model Checking and Abstract Interpretation 8931 2015
1144363157;Computer Analysis of Images and Patterns;Computer Analysis of Images and Patterns 8048 2013
2755110255;IEEE International Conference on Intelligent Systems;IEEE International Conference on Intelligent Systems 322 2015
1159491267;Foundations of Genetic Algorithms;Foundations of Genetic Algorithms 3 1995
1131603458;International Symposium on Distributed Computing;International Symposium on Distributed Computing 7611 2012
1182750626;Asia Information Retrieval Symposium;Asia Information Retrieval Symposium 7675 2012
1156749314;International Conference on Web Information Systems and Technologies;International Conference on Web Information Systems and Technologies 140 2012
2898133633;Conference Cognitive Science;Conference Cognitive Science 35 2013
1159975077;International Conference on Systems;International Conference on Systems 46 2013
1132800348;Electronic Government;Electronic Government 6267 2010
1174979956;European Conference on Modelling Foundations and Applications;European Conference on Modelling Foundations and Applications 8569 2014
2622739841;International Conference on Signal Processing;International Conference on Signal Processing 260 2011
2756176944;International Conference on Computer and Computing Technologies in Agriculture;International Conference on Computer and Computing Technologies in Agriculture 370 2011
2759152645;Multicore Software Engineering, Performance, and Tools;Multicore Software Engineering, Performance, and Tools 2013 2013
1175727152;International Symposium on Algorithms and Computation;International Symposium on Algorithms and Computation 7074 2011
1140216390;International Conference on Information Systems;International Conference on Information Systems 3 2013
1181068974;Fuzzy Systems and Knowledge Discovery;Fuzzy Systems and Knowledge Discovery 4 2011
1187615537;Fundamental Approaches to Software Engineering;Fundamental Approaches to Software Engineering 7212 2012
2759135577;Workshop on Rewriting Logic and Its Applications;Workshop on Rewriting Logic and Its Applications 8663 2014
1188440540;Social Informatics;Social Informatics 8852 2014
1179205117;International Conference on Swarm Intelligence;International Conference on Swarm Intelligence 7331 2012
2757021190;Joint European Conferences on Theory and Practice of Software;Joint European Conferences on Theory and Practice of Software 8415 2014
2758283624;Fast Software Encryption;Fast Software Encryption 6733 2011
1199552999;International Provenance and Annotation Workshop;International Provenance and Annotation Workshop 7525 2012
1140902380;Mathematical Methods, Models, and Architectures for Network Security Systems;Mathematical Methods, Models, and Architectures for Network Security Systems 7531 2012
2756200542;International Conference on Product Lifecycle Management;International Conference on Product Lifecycle Management 409 2013
1133776791;Computer Science Symposium in Russia;Computer Science Symposium in Russia 90 2017
2754048035;International Conference on Latent Variable Analysis and Signal Separation;International Conference on Latent Variable Analysis and Signal Separation 7191 2012
2760291156;Nordic Conference on Secure IT Systems;Nordic Conference on Secure IT Systems 7127 2010
2758880462;Algorithmic Decision Theory;Algorithmic Decision Theory 5783 2009
1177357382;Interactive Theorem Proving;Interactive Theorem Proving 7998 2013
2758700152;International Middleware Conference;International Middleware Conference 8275 2013
1199667400;Computer Vision/Computer Graphics Collaboration Techniques;Computer Vision/Computer Graphics Collaboration Techniques 6930 2011
1153382799;IEEE International Conference on High Performance Computing, Data, and Analytics;IEEE International Conference on High Performance Computing, Data, and Analytics 2913 2003
1129775427;Tests and Proofs;Tests and Proofs 8570 2014
1152604843;International Conference on Artificial Immune Systems;International Conference on Artificial Immune Systems 7597 2012
1156437979;Mathematics of Language;Mathematics of Language 6878 2011
1134465752;Distributed Applications and Interoperable Systems;Distributed Applications and Interoperable Systems 7272 2012
1199774281;International Symposium on Experimental Robotics;International Symposium on Experimental Robotics 79 2014
2756896743;Conference on Algebraic Informatics;Conference on Algebraic Informatics 8080 2013
1176326080;Open Source Systems;Open Source Systems 365 2011
1133508372;Latin American Symposium on Theoretical Informatics;Latin American Symposium on Theoretical Informatics 8392 2014
2756314562;World Congress on Medical and Health Informatics, Medinfo;World Congress on Medical and Health Informatics, Medinfo 192 2013
1191926394;Graph Drawing;Graph Drawing 6502 2010
1141821850;International Colloquium on Automata, Languages and Programming;International Colloquium on Automata, Languages and Programming 7392 2012
2754145061;European Conference on Logics in Artificial Intelligence;European Conference on Logics in Artificial Intelligence 7519 2012
1161567657;Semantics and Digital Media Technologies;Semantics and Digital Media Technologies 6725 2010
1140917629;Wireless Algorithms, Systems, and Applications;Wireless Algorithms, Systems, and Applications 7405 2012
1171431627;Workshop on Biomedical Image Registration;Workshop on Biomedical Image Registration 8545 2014
1134440762;Conference on Automated Deduction;Conference on Automated Deduction 1831 2000
2756132311;International Conference on Pairing-based Cryptography;International Conference on Pairing-based Cryptography 8365 2013
1185016349;Autonomous Infrastructure, Management and Security;Autonomous Infrastructure, Management and Security 8508 2014
1187862248;Brazilian Symposium on Bioinformatics;Brazilian Symposium on Bioinformatics 15 2018
2755503935;International Conference on Engineering Applications of Neural Networks;International Conference on Engineering Applications of Neural Networks 43 2009
1136274694;Pattern Recognition and Machine Intelligence;Pattern Recognition and Machine Intelligence 6744 2011
1172379331;Artificial Intelligence in Education;Artificial Intelligence in Education 7926 2013
1135965941;Kommunikation in Verteilten Systemen;Kommunikation in Verteilten Systemen 17 2009
1155500043;Machine Vision Applications;Machine Vision Applications 7 1994
1155975711;Automation, Robotics and Control Systems;Automation, Robotics and Control Systems 7179 2012
1188587990;Conference of the European Chapter of the Association for Computational Linguistics;Conference of the European Chapter of the Association for Computational Linguistics 11 2006
1164963593;Language Resources and Evaluation;Language Resources and Evaluation 2008 2008
1176104424;International Conference on Cryptology in India;International Conference on Cryptology in India 3348 2004
1123338449;Asian Conference on Intelligent Information and Database Systems;Asian Conference on Intelligent Information and Database Systems 8398 2014
1178744818;Declarative Agent Languages and Technologies;Declarative Agent Languages and Technologies 7784 2012
1142743330;SIAM International Conference on Data Mining;SIAM International Conference on Data Mining 2014 2014
1128163780;International Conference on Computer Safety, Reliability, and Security;International Conference on Computer Safety, Reliability, and Security 8666 2014
1135145953;International Workshop on Quality of Service;International Workshop on Quality of Service 2601 2003
2754526506;International Conference on Digital Human Modeling and Applications in Health, Safety, Ergonomics and Risk Management;International Conference on Digital Human Modeling and Applications in Health, Safety, Ergonomics and Risk Management 8529 2014
2758283544;International Conference on Typed Lambda Calculi and Applications;International Conference on Typed Lambda Calculi and Applications 6690 2011
2760380534;Formal Ontologies Meet Industry;Formal Ontologies Meet Industry 174 2008
1152803012;International Conference on Data Management in Grid and P2P Systems;International Conference on Data Management in Grid and P2P Systems 8648 2014
2759123102;Agile Processes in Software Engineering and Extreme Programming;Agile Processes in Software Engineering and Extreme Programming 179 2014
1168671587;Adaptive Agents and Multi-Agents Systems;Adaptive Agents and Multi-Agents Systems 2 2013
1136617647;Artificial Intelligence Applications and Innovations;Artificial Intelligence Applications and Innovations 382 2012
1136631244;International Conference on Principles of Distributed Systems;International Conference on Principles of Distributed Systems 8878 2014
2756351210;International Conference on Advances in Production Management Systems;International Conference on Advances in Production Management Systems 415 2013
1146437905;Computer Aided Systems Theory;Computer Aided Systems Theory 6927 2011
1197908299;Ambient Intelligence;Ambient Intelligence 219 2013
1174644639;Asian Conference on Computer Vision;Asian Conference on Computer Vision 7727 2012
2755509239;International Conference on Virtual, Augmented and Mixed Reality;International Conference on Virtual, Augmented and Mixed Reality 8022 2013
2757674621;Non-Classical Models for Automata and Applications;Non-Classical Models for Automata and Applications 112 2011
1168103165;Computer Music Modeling and Retrieval;Computer Music Modeling and Retrieval 8905 2013
1122238926;Privacy in Statistical Databases;Privacy in Statistical Databases 7556 2012
1120608147;International Conference on Machine Learning and Cybernetics;International Conference on Machine Learning and Cybernetics 3930 2005
1184048318;International Workshop on Security;International Workshop on Security 7783 2012
1141769385;European Conference on Principles of Data Mining and Knowledge Discovery;European Conference on Principles of Data Mining and Knowledge Discovery 9 2008
1187360205;Simulation, Modeling, and Programming for Autonomous Robots;Simulation, Modeling, and Programming for Autonomous Robots 7628 2012
1162579948;Model-based Methodologies for Pervasive and Embedded Software;Model-based Methodologies for Pervasive and Embedded Software 7706 2012
2758276724;Human-Centered Software Engineering;Human-Centered Software Engineering 7623 2012
2898404022;International Conference Agreement Technologies;International Conference Agreement Technologies 8068 2013
2755281958;International Conference on Heterogeneous Networking for Quality, Reliability, Security and Robustness;International Conference on Heterogeneous Networking for Quality, Reliability, Security and Robustness 3 2016
1165841369;Workshop on Graph-Theoretic Concepts in Computer Science;Workshop on Graph-Theoretic Concepts in Computer Science 1335 1997
1126660374;Cooperative Information Agents;Cooperative Information Agents 3191 2004
2621951043;Hybrid Intelligent Systems;Hybrid Intelligent Systems 11 2014
2760553273;TPC Technology Conference;TPC Technology Conference 6417 2010
1138438968;Industrial and Engineering Applications of Artificial Intelligence and Expert Systems;Industrial and Engineering Applications of Artificial Intelligence and Expert Systems 8482 2014
1162013546;Conference on Computational Complexity;Conference on Computational Complexity 33 2015
2760478614;Bio-Science and Bio-Technology;Bio-Science and Bio-Technology 118 2010
1180172597;Theory and Practice of Digital Libraries;Theory and Practice of Digital Libraries 7489 2012
1121391727;Mexican International Conference on Artificial Intelligence;Mexican International Conference on Artificial Intelligence 8856 2014
1179291824;Soft Methods in Probability and Statistics;Soft Methods in Probability and Statistics 190 2013
1200366406;IFIP International Conference on Theoretical Computer Science;IFIP International Conference on Theoretical Computer Science 8705 2014
1120750887;International Conference on Algorithms and Architectures for Parallel Processing;International Conference on Algorithms and Architectures for Parallel Processing 7017 2011
2754747283;International Conference on Engineering Secure Software and Systems;International Conference on Engineering Secure Software and Systems 7159 2012
2754008443;European Conference on Applications of Evolutionary Computation;European Conference on Applications of Evolutionary Computation 8602 2014
1148330047;Knowledge Acquisition, Modeling and Management;Knowledge Acquisition, Modeling and Management 7603 2012
1121344769;Ad Hoc Networks;Ad Hoc Networks 8629 2014
2757461969;Central and East European Conference on Software Engineering Techniques;Central and East European Conference on Software Engineering Techniques 4980 2008
1139008316;International Conference on Cloud Computing and Services Science;International Conference on Cloud Computing and Services Science 3 2014
1193108635;Algorithmic Learning Theory;Algorithmic Learning Theory 8776 2014
1164386382;Artificial Neural Networks in Pattern Recognition;Artificial Neural Networks in Pattern Recognition 8774 2014
1151209843;Intelligent Virtual Agents;Intelligent Virtual Agents 6895 2011
1148050328;Iberian Conference on Pattern Recognition and Image Analysis;Iberian Conference on Pattern Recognition and Image Analysis 7887 2013
1131091954;Conference on Computability in Europe;Conference on Computability in Europe 6735 2011
2756525286;International Conference on Ontology Matching;International Conference on Ontology Matching 304 2007
2753996301;Conference on Artificial Intelligence Research and Development;Conference on Artificial Intelligence Research and Development 220 2010
1166178324;Network and Parallel Computing;Network and Parallel Computing 25 2007
1188965700;Research in Computational Molecular Biology;Research in Computational Molecular Biology 8394 2014
1130292186;Security and Privacy in Communication Networks;Security and Privacy in Communication Networks 152 2014
1200006883;Inductive Logic Programming;Inductive Logic Programming 7207 2011
2760193176;International Symposium on Mathematical Morphology and Its Application to Signal and Image Processing;International Symposium on Mathematical Morphology and Its Application to Signal and Image Processing 6671 2011
1143423991;Conference on Combinatorial Optimization and Applications;Conference on Combinatorial Optimization and Applications 6831 2011
2757046586;Coordination, Organizations, Institutions, and Norms in Agent Systems;Coordination, Organizations, Institutions, and Norms in Agent Systems 6541 2010
1142642735;Quantitative Evaluation of Systems;Quantitative Evaluation of Systems 8657 2014
1137793517;Passive and Active Network Measurement;Passive and Active Network Measurement 7799 2013
1121935577;Metadata and Semantics Research;Metadata and Semantics Research 478 2014
1168046211;Asian Test Symposium;Asian Test Symposium 16 2000
1202305278;International Conference on Graph Transformation;International Conference on Graph Transformation 3256 2004
1133365479;International Conference on Formal Engineering Methods;International Conference on Formal Engineering Methods 8829 2014
2754186610;Euro-Mediterranean Conference;Euro-Mediterranean Conference 8740 2014
1171689754;Affective Computing and Intelligent Interaction;Affective Computing and Intelligent Interaction 6975 2011
1190684087;Hybrid Artificial Intelligence Systems;Hybrid Artificial Intelligence Systems 8480 2014
1144830660;Pacific Rim International Conference on Multi-Agents;Pacific Rim International Conference on Multi-Agents 7047 2011
2538859667;Theorem Proving in Higher Order Logics;Theorem Proving in Higher Order Logics 3 1992
2755247319;International Conference on Technologies and Applications of Artificial Intelligence;International Conference on Technologies and Applications of Artificial Intelligence 8916 2014
1159075210;Asian Simulation Conference;Asian Simulation Conference 474 2014
1176219363;International Joint Conference on Automated Reasoning;International Joint Conference on Automated Reasoning 3097 2004
2757547734;International Workshop and International Workshop on Approximation, Randomization, and Combinatorial Optimization. Algorithms and Techniques;International Workshop and International Workshop on Approximation, Randomization, and Combinatorial Optimization. Algorithms and Techniques 4627 2007
1169820221;International Conference on Hybrid Information Technology;International Conference on Hybrid Information Technology 6935 2011
2754527366;International Conference on Business Informatics Research;International Conference on Business Informatics Research 128 2012
1142184186;Collaborative Agents - REsearch and Development;Collaborative Agents - REsearch and Development 498 2014
1165791477;World Congress on Engineering;World Congress on Engineering 2165 2007
1166511975;Automated Software Engineering;Automated Software Engineering 10 2003
1181892187;Wired/Wireless Internet Communications;Wired/Wireless Internet Communications 6649 2011
1120281879;Computer and Information Technology;Computer and Information Technology 19 2011
1129611459;Formal Methods for Open Object-Based Distributed Systems;Formal Methods for Open Object-Based Distributed Systems 669 2017
1142809651;Field and Service Robotics;Field and Service Robotics 92 2014
1147734270;Cooperative Information Systems;Cooperative Information Systems 8185 2013
1122308263;Workshop on Information Security Applications;Workshop on Information Security Applications 2908 2003
2755546526;International Conference on Digital Government Research;International Conference on Digital Government Research 14 2009
1190659448;Signal Processing Systems;Signal Processing Systems 25 2000
1132231445;Discovery Science;Discovery Science 8777 2014
2755388662;Programmable Devices and Embedded Systems;Programmable Devices and Embedded Systems 46 2013
2626098776;Web Science;Web Science 32 2002
1163264588;European Conference on Parallel Processing;European Conference on Parallel Processing 8632 2014
2626641194;Certified Programs and Proofs;Certified Programs and Proofs 7679 2012
1200029762;Motion in Games;Motion in Games 7660 2012
1189194555;Fundamentals of Computation Theory;Fundamentals of Computation Theory 8070 2013
2754669061;International Conference on Intelligent Information Processing;International Conference on Intelligent Information Processing 12 2010
1162850487;Fundamentals of Software Engineering;Fundamentals of Software Engineering 7141 2011
1136921216;Computing and Combinatorics Conference;Computing and Combinatorics Conference 7936 2013
2759718255;International Workshop on Groupware;International Workshop on Groupware 8658 2014
2754031194;International Conference on User Modeling, Adaptation, and Personalization;International Conference on User Modeling, Adaptation, and Personalization 8538 2014
2757139483;Engineering Secure Software and Systems;Engineering Secure Software and Systems 8364 2014
1123581667;Analytical and Stochastic Modeling Techniques and Applications;Analytical and Stochastic Modeling Techniques and Applications 6751 2011
1162660226;Web and Wireless Geographical Information Systems;Web and Wireless Geographical Information Systems 7236 2012
1161606401;International Conference on Computer Vision Systems;International Conference on Computer Vision Systems 7963 2013
2898111911;International Conference Informatics Schools;International Conference Informatics Schools 8730 2014
1195960517;International Congress on Mathematical Software;International Congress on Mathematical Software 6327 2010
2754294205;International Journal of Next-Generation Computing;International Journal of Next-Generation Computing 3 2012
2898313861;International Conference Spatial Cognition;International Conference Spatial Cognition 8684 2014
1159071770;Tools and Algorithms for Construction and Analysis of Systems;Tools and Algorithms for Construction and Analysis of Systems 2988 2004
1175959126;Critical Information Infrastructures Security;Critical Information Infrastructures Security 8328 2013
2760295950;Nature Inspired Cooperative Strategies for Optimization;Nature Inspired Cooperative Strategies for Optimization 387 2011
1131777435;Formal Ontology in Information Systems;Formal Ontology in Information Systems 183 2008
2754847692;International Conference on Independent Component Analysis and Signal Separation;International Conference on Independent Component Analysis and Signal Separation 5441 2009
2754275429;International Conference on Security and Privacy in Communication Systems;International Conference on Security and Privacy in Communication Systems 127 2013
1150523337;International Syposium on Methodologies for Intelligent Systems;International Syposium on Methodologies for Intelligent Systems 6804 2011
1150940485;Microprocessor Test and Verification;Microprocessor Test and Verification 16 2000
1198225011;International Conference on Bio-inspired Systems and Signal Processing;International Conference on Bio-inspired Systems and Signal Processing 1 2010
2757928577;International Conference on Information Systems, Technology and Management;International Conference on Information Systems, Technology and Management 31 2009
1144017017;Symposium on Search Based Software Engineering;Symposium on Search Based Software Engineering 6956 2011
1177537908;Machine Learning and Data Mining in Pattern Recognition;Machine Learning and Data Mining in Pattern Recognition 7376 2012
1124547647;Integration of AI and OR Techniques in Constraint Programming;Integration of AI and OR Techniques in Constraint Programming 8451 2014
1185621975;Semantic Web Applications and Perspectives;Semantic Web Applications and Perspectives 314 2007
2623176867;Availability, Reliability and Security;Availability, Reliability and Security 7465 2012
1178327129;Pacific-Asia Conference on Knowledge Discovery and Data Mining;Pacific-Asia Conference on Knowledge Discovery and Data Mining 7819 2013
1176895911;International Conference on Artificial Intelligence and Soft Computing;International Conference on Artificial Intelligence and Soft Computing 7895 2013
1129450674;Evolutionary Computation, Machine Learning and Data Mining in Bioinformatics;Evolutionary Computation, Machine Learning and Data Mining in Bioinformatics 7246 2012
2755218236;International Conference on Functional Imaging and Modeling of Heart;International Conference on Functional Imaging and Modeling of Heart 7945 2013
