conference_id;name;publication
1175443996;Computing: The Australasian Theory Symposium;Computing: The Australasian Theory Symposium 51 2006
1159310735;Mathematics of Program Construction;Mathematics of Program Construction 7342 2012
1185392286;International Conference on Image and Signal Processing;International Conference on Image and Signal Processing 7340 2012
1158234796;Types for Proofs and Programs;Types for Proofs and Programs 19 2013
1140240273;International Conference on Information Networking;International Conference on Information Networking 87 2003
1155163656;Rules and Rule Markup Languages for the Semantic Web;Rules and Rule Markup Languages for the Semantic Web 8620 2014
2622723275;International Conference on Natural Computation;International Conference on Natural Computation 3610 2005
1180605136;Distributed Autonomous Robotic Systems;Distributed Autonomous Robotic Systems 83 2013
2760803309;Mediterranean Conference on Information Systems;Mediterranean Conference on Information Systems 129 2012
1187005110;Starting AI Researchers' Symposium;Starting AI Researchers' Symposium 222 2010
2759111420;Auctions, Market Mechanisms and Their Applications;Auctions, Market Mechanisms and Their Applications 3 2015
1153474980;International Conference on Contemporary Computing;International Conference on Contemporary Computing 94 2010
1193120152;International Conference on Pattern Recognition Applications and Methods;International Conference on Pattern Recognition Applications and Methods 318 2015
1124147936;Practical Aspects of Declarative Languages;Practical Aspects of Declarative Languages 8324 2014
2754590749;International Conference on Future Generation Information Technology;International Conference on Future Generation Information Technology 7105 2011
2754459719;European Control Conference;European Control Conference 13 2007
1121506370;NASA Formal Methods;NASA Formal Methods 7226 2012
1159769685;International Symposium on Robotics;International Symposium on Robotics 70 2011
2623229432;Asilomar Conference on Signals, Systems and Computers;Asilomar Conference on Signals, Systems and Computers 2 1997
1180131379;International Conference on e-Business;International Conference on e-Business 314 2011
1163902177;International Conference on Robotics and Automation;International Conference on Robotics and Automation 22 2007
1202201565;International Conference on Web Services;International Conference on Web Services 4184 2006
1147409521;Bioinspired Models of Network, Information, and Computing Systems;Bioinspired Models of Network, Information, and Computing Systems 87 2010
1139209228;Electronic Healthcare;Electronic Healthcare 69 2010
2753988958;International Andrei Ershov Memorial Conference on Perspectives of System Informatics;International Andrei Ershov Memorial Conference on Perspectives of System Informatics 110 1996
1173986096;Smart Graphics;Smart Graphics 6815 2011
1119684440;European Public Key Infrastructure Workshop;European Public Key Infrastructure Workshop 7163 2011
2756151189;Systems Communications;Systems Communications 27 2010
2756405054;International Conference on Curves and Surfaces;International Conference on Curves and Surfaces 6920 2010
2898186791;Workshop practical aspects automated reasoning;Workshop practical aspects automated reasoning 31 2014
1125967516;International Symposium on Computer and Information Sciences;International Symposium on Computer and Information Sciences 2869 2003
2755996488;World Computer Congress on Algorithms, Software, Architecture;World Computer Congress on Algorithms, Software, Architecture 1 1992
2757151199;Parallel Computing Technologies;Parallel Computing Technologies 6873 2011
1137907615;Foundations of Information and Knowledge Systems;Foundations of Information and Knowledge Systems 3861 2006
2758299037;Mathematical Methods for Curves and Surfaces;Mathematical Methods for Curves and Surfaces 8177 2012
2753945848;Analysis, Design, and Evaluation of Human-Machine Systems;Analysis, Design, and Evaluation of Human-Machine Systems 40 2007
1137547646;International Conference on Health Informatics;International Conference on Health Informatics 2 2008
1193719506;International Conference on Mobile Multimedia Communications;International Conference on Mobile Multimedia Communications 79 2011
1156338894;Articulated Motion and Deformable Objects;Articulated Motion and Deformable Objects 7378 2012
1134271186;International Conference on Intelligent Computing;International Conference on Intelligent Computing 7390 2012
1199437547;Symposium on Languages, Applications and Technologies;Symposium on Languages, Applications and Technologies 29 2013
2756336174;International Conference on Applied Informatics and Communication;International Conference on Applied Informatics and Communication 22 2011
1195635621;Workshop on Logic, Language, Information and Computation;Workshop on Logic, Language, Information and Computation 8071 2013
1187669966;International Conference on Legal Knowledge and Information Systems;International Conference on Legal Knowledge and Information Systems 205 2009
1203599204;Grid Economics and Business Models;Grid Economics and Business Models 7714 2012
1163343099;International Conference on Ultra Modern Telecommunications;International Conference on Ultra Modern Telecommunications 31 2011
1173741378;Atlantic Web Intelligence Conference;Atlantic Web Intelligence Conference 43 2007
2758590630;Knowledge Representation for Health-Care;Knowledge Representation for Health-Care 8903 2014
1140490152;Pattern Recognition in Bioinformatics;Pattern Recognition in Bioinformatics 7986 2013
1131576334;International Conference on Adaptive and Natural Computing Algorithms;International Conference on Adaptive and Natural Computing Algorithms 7824 2013
2754436836;International Conference on Game Theory for Networks;International Conference on Game Theory for Networks 105 2012
2243649203;International Conference on Multimedia Communications;International Conference on Multimedia Communications 287 2012
2898598163;International Workshop Automated Verification Critical Systems;International Workshop Automated Verification Critical Systems 53 2013
1184014513;Electronic Commerce and Web Technologies;Electronic Commerce and Web Technologies 5183 2008
1193566715;Distributed Systems: Operations and Management;Distributed Systems: Operations and Management 4785 2007
1158801738;Probabilistic Graphical Models;Probabilistic Graphical Models 8754 2014
2759074181;Secure Data Management (VLDB Workshop);Secure Data Management (VLDB Workshop) 8425 2013
1126517753;International Conference on Electronic Publishing;International Conference on Electronic Publishing 31 2011
2754941121;IET networks;IET networks 5 2016
1152171191;Asian Conference on Machine Learning;Asian Conference on Machine Learning 39 2014
2760174955;Equation-Based Object-Oriented Modeling Languages and Tools;Equation-Based Object-Oriented Modeling Languages and Tools 84 2013
2537396833;Association for Information Science and Technology;Association for Information Science and Technology 68 2017
1152985112;Pacific Rim Knowledge Acquisition Workshop;Pacific Rim Knowledge Acquisition Workshop 8863 2014
1201175904;International Conference on Reliable Software Technologies;International Conference on Reliable Software Technologies 9111 2015
1132689015;Symposium on Geometry Processing;Symposium on Geometry Processing 35 2016
2233046399;International Conference on Bioinformatics and Biomedical Engineering;International Conference on Bioinformatics and Biomedical Engineering 9044 2015
1140961231;Intelligent Information Systems;Intelligent Information Systems 46 2016
1134494671;International Conference on Parallel Architectures and Compilation Techniques;International Conference on Parallel Architectures and Compilation Techniques 24 1995
1153467564;Joint Conference on Knowledge-Based Software Engineering;Joint Conference on Knowledge-Based Software Engineering 466 2014
1177288818;Computational Science and Engineering;Computational Science and Engineering 103 2015
1179947304;Asia-Pacific Network Operations and Management Symposium;Asia-Pacific Network Operations and Management Symposium 2013 2013
2898296047;International Conference Theory and Practice Digital Libraries;International Conference Theory and Practice Digital Libraries 416 2013
1198129048;Languages and Compilers for Parallel Computing;Languages and Compilers for Parallel Computing 8664 2013
2754000795;International Conference on Innovative Computing Technology;International Conference on Innovative Computing Technology 2 2011
1140144625;Arts and Technology;Arts and Technology 116 2013
1168823384;European Workshop on Multi-Agent Systems;European Workshop on Multi-Agent Systems 8953 2014
1195013065;International Geoscience and Remote Sensing Symposium;International Geoscience and Remote Sensing Symposium 1 2009
2754091926;Annual Symposium on Combinatorial Search;Annual Symposium on Combinatorial Search 25 2012
2232857946;International Conference of the IEEE Engineering in Medicine and Biology Society;International Conference of the IEEE Engineering in Medicine and Biology Society 2015 2015
1131589359;Measurement and Modeling of Computer Systems;Measurement and Modeling of Computer Systems 42 2014
1184750640;System Analysis and Modeling;System Analysis and Modeling 8769 2014
1127325140;Neural Information Processing Systems;Neural Information Processing Systems 16 2003
2756369731;International Conference on Speech and Computer;International Conference on Speech and Computer 8773 2014
1199066382;International Conference on Bioinformatics;International Conference on Bioinformatics 2010 2010
1149039622;European Conference on Information Systems;European Conference on Information Systems 32 2017
1168876913;International Wireless Internet Conference;International Wireless Internet Conference 8 2014
2754907925;International Journal of Manufacturing, Materials, and Mechanical Engineering;International Journal of Manufacturing, Materials, and Mechanical Engineering 5 2015
1136152680;Computer Supported Collaborative Learning;Computer Supported Collaborative Learning 10 2015
2755031677;International Journal of Energy Optimization and Engineering;International Journal of Energy Optimization and Engineering 4 2015
1126288421;Conference on Intelligent Text Processing and Computational Linguistics;Conference on Intelligent Text Processing and Computational Linguistics 9041 2015
1195049314;Conference on Computer Supported Cooperative Work;Conference on Computer Supported Cooperative Work 24 2015
2754725756;International Conference on Selected areas in Cryptography;International Conference on Selected areas in Cryptography 7707 2012
2755576832;Biomedical and Health Informatics;Biomedical and Health Informatics 20 2016
1191670040;Scandinavian Conference on Information Systems;Scandinavian Conference on Information Systems 124 2012
2626753082;Trust, Security And Privacy In Computing And Communications;Trust, Security And Privacy In Computing And Communications 3 2015
2898121709;International Conference Ambient Systems, Networks and Technologies;International Conference Ambient Systems, Networks and Technologies 52 2015
1162361837;International Work-Conference on Artificial and Natural Neural Networks;International Work-Conference on Artificial and Natural Neural Networks 9094 2015
1192551523;Service-Oriented Computing and Applications;Service-Oriented Computing and Applications 10 2016
2754353081;EMC/HumanCom;EMC/HumanCom 25 2014
1125063881;International Conference on Formal Concept Analysis;International Conference on Formal Concept Analysis 9113 2015
2754706624;International Conference on Digital Image Processing;International Conference on Digital Image Processing 9631 2015
2898349943;NASA Formal Methods Symposium;NASA Formal Methods Symposium 9058 2015
1192791786;Conference on Risks and Security of Internet and Systems;Conference on Risks and Security of Internet and Systems 8924 2014
2758183515;International Conference on Foundation of Software Technology and Theoretical Computer Science;International Conference on Foundation of Software Technology and Theoretical Computer Science 29 2014
2755703685;International Conference on Augmented Cognition;International Conference on Augmented Cognition 9183 2015
1160032607;Symposium on Principles of Programming Languages;Symposium on Principles of Programming Languages 52 2017
1152305746;Computer Science and its Applications;Computer Science and its Applications 456 2015
2754893992;Computing in Cardiology Conference;Computing in Cardiology Conference 42 2015
1183877910;Smart Card Research and Advanced Application Conference;Smart Card Research and Advanced Application Conference 8968 2014
2755905592;IET wireless sensor systems;IET wireless sensor systems 5 2015
1182245819;Machines, Computations, and Universality;Machines, Computations, and Universality 9288 2015
1198780418;Conference on Decision and Control;Conference on Decision and Control 2016 2015
2754456056;IEEE International Conference on Software Analysis, Evolution, and Reengineering;IEEE International Conference on Software Analysis, Evolution, and Reengineering 1 2016
1148841876;Trends in Functional Programming;Trends in Functional Programming 7829 2012
1146606187;International Conference on Persuasive Technology;International Conference on Persuasive Technology 9072 2015
1199981023;German Conference on Bioinformatics;German Conference on Bioinformatics 26 2012
1192710900;International Symposium on Circuits and Systems;International Symposium on Circuits and Systems 63 2016
2623571572;Conference of the Industrial Electronics Society;Conference of the Industrial Electronics Society 59 2015
2755005449;Workshop on Hyperspectral Image and Signal Processing: Evolution in Remote Sensing;Workshop on Hyperspectral Image and Signal Processing: Evolution in Remote Sensing 2014 2014
2754306351;International Conference on Human Aspects of IT for Aged Population;International Conference on Human Aspects of IT for Aged Population 9194 2015
2898127558;International Workshop Formal Techniques for Safety-Critical Systems;International Workshop Formal Techniques for Safety-Critical Systems 476 2014
2623113034;International Conference on Big Data;International Conference on Big Data 20 2015
1191598575;International Symposium on Chinese Spoken Language Processing;International Symposium on Chinese Spoken Language Processing 82 2014
2757320638;Data Mining in Bioinformatics;Data Mining in Bioinformatics 14 2016
2760407404;Language and Technology Conference;Language and Technology Conference 8387 2011
2755887652;International Conference on Future Networks;International Conference on Future Networks 56 2015
1121623334;Graphics Recognition;Graphics Recognition 7423 2011
1123704270;International Symposium on Environmental Software Systems;International Symposium on Environmental Software Systems 448 2015
1131368478;Fun with Algorithms;Fun with Algorithms 58 2014
1173149485;International Conference on Evaluation of Novel Approaches to Software Engineering;International Conference on Evaluation of Novel Approaches to Software Engineering 69 2009
1175089206;International Conference on Management of Data;International Conference on Management of Data 43 2016
1175044124;Mexican Conference on Pattern Recognition;Mexican Conference on Pattern Recognition 9116 2015
1141336450;Modelling, Computation and Optimization in Information Systems and Management Sciences;Modelling, Computation and Optimization in Information Systems and Management Sciences 359 2015
1128498849;Unifying Theories of Programming;Unifying Theories of Programming 8963 2014
2757662932;Semantics in Data and Knowledge Bases;Semantics in Data and Knowledge Bases 7693 2011
1142458017;Tbilisi Symposium on Logic, Language, and Computation;Tbilisi Symposium on Logic, Language, and Computation 8984 2013
2756487522;Exploring Modeling Methods for Systems Analysis and Design;Exploring Modeling Methods for Systems Analysis and Design 214 2015
2898200789;IEEE Conference Dependable and Secure Computing;IEEE Conference Dependable and Secure Computing 14 2017
1128095430;Software Engineering and Formal Methods;Software Engineering and Formal Methods 8368 2013
1171945054;International Conference on Research and Education in Robotics;International Conference on Research and Education in Robotics 33 2008
2753990971;International Conference on Human Centered Computing;International Conference on Human Centered Computing 12 2014
2755702938;International Semantic Technology Conference;International Semantic Technology Conference 7774 2012
2754698265;International Conference on Mobile Networks and Management;International Conference on Mobile Networks and Management 141 2014
1149545486;Advances in Computer Games;Advances in Computer Games 13 2011
1151509452;Biomedical Engineering Systems and Technologies;Biomedical Engineering Systems and Technologies 452 2013
2754632699;ACM Transactions on Asian and Low-Resource Language Information Processing;ACM Transactions on Asian and Low-Resource Language Information Processing 14 2015
1139686887;World Summit on the Knowledge Society;World Summit on the Knowledge Society 278 2011
1155648657;Mobile Lightweight Wireless Systems;Mobile Lightweight Wireless Systems 81 2011
2537594308;USENIX Security Symposium;USENIX Security Symposium 2014 2014
1155092908;Personal, Indoor and Mobile Radio Communications;Personal, Indoor and Mobile Radio Communications 3 2005
1156109491;Statistical and Scientific Database Management;Statistical and Scientific Database Management 339 1988
2756415675;International Conference on Detection of intrusions and malware, and vulnerability assessment;International Conference on Detection of intrusions and malware, and vulnerability assessment 4579 2007
2756326366;International Conference on Entity-Relationship Approach;International Conference on Entity-Relationship Approach 881 1994
1176978676;Vehicular Technology Conference;Vehicular Technology Conference 2 2006
2623792093;Chinese Control Conference;Chinese Control Conference 49 2012
2760775186;Joint International Conference on Vector and Parallel Processing: Parallel Processing;Joint International Conference on Vector and Parallel Processing: Parallel Processing 854 1994
1191172908;Algebraic Methodology and Software Technology;Algebraic Methodology and Software Technology 183 1997
1134031032;Mobile Data Management;Mobile Data Management 1 2015
1143723981;International Conference on Computer Communications;International Conference on Computer Communications 2 2005
1160213847;International Symposium on Computers and Communications;International Symposium on Computers and Communications 1 2004
1170827922;Next Generation Information Technologies and Systems;Next Generation Information Technologies and Systems 8 1997
1165958984;Computer Science Logic;Computer Science Logic 12 2011
1193251834;International Conference on Algorithms and Complexity;International Conference on Algorithms and Complexity 1767 2000
2756397737;Transactions on Emerging Telecommunications Technologies;Transactions on Emerging Telecommunications Technologies 25 2014
1190039108;Advances in Computing and Communications;Advances in Computing and Communications 3 1994
2755241531;IEEE International Conference on Automatic Face & Gesture Recognition;IEEE International Conference on Automatic Face & Gesture Recognition 1 2015
2755830850;IEEE Canada International Humanitarian Technology Conference;IEEE Canada International Humanitarian Technology Conference 1 2014
1132593990;Extending Database Technology;Extending Database Technology 1057 1996
1200052134;Congress on Evolutionary Computation;Congress on Evolutionary Computation 1 2003
2755684428;Revista Avances en Sistemas e Informática;Revista Avances en Sistemas e Informática 5 2008
1168181294;Advances in Multimedia;Advances in Multimedia 3768 2005
1121227772;International Conference on Acoustics, Speech, and Signal Processing;International Conference on Acoustics, Speech, and Signal Processing 7 1982
1168170433;International Conference on Control, Automation, Robotics and Vision;International Conference on Control, Automation, Robotics and Vision 2 2002
1152271581;Computer Graphics International;Computer Graphics International 4035 2006
2756788986;Italian Conference on Computational Logic;Italian Conference on Computational Logic 124 2013
2756318837;International Conference on Deductive and Object-Oriented Databases;International Conference on Deductive and Object-Oriented Databases 1341 1997
1187587159;International Symposium on Biomedical Imaging;International Symposium on Biomedical Imaging 2015 2015
1131420910;Global Communications Conference;Global Communications Conference 1 2002
1174934631;International Conference on Networks;International Conference on Networks 5 1995
1162243218;Parallel Processing and Applied Mathematics;Parallel Processing and Applied Mathematics 6067 2009
2755183362;International Conference on Spoken Language Processing;International Conference on Spoken Language Processing 1 1996
2754996082;IEEE Conference on Business Informatics;IEEE Conference on Business Informatics 2 2015
2754723299;International Conference on Artificial Intelligence Planning Systems;International Conference on Artificial Intelligence Planning Systems 21 2000
1173648842;International Workshop on Computational Forensics;International Workshop on Computational Forensics 5158 2008
1159702908;Embedded and Ubiquitous Computing;Embedded and Ubiquitous Computing 4097 2006
1143160721;Computer Software and Applications Conference;Computer Software and Applications Conference 1 2005
1131239835;Communications and Mobile Computing;Communications and Mobile Computing 16 2016
1129429480;Robotics, Automation and Mechatronics;Robotics, Automation and Mechatronics 2 2004
1161701531;Wireless and Mobile Computing, Networking and Communications;Wireless and Mobile Computing, Networking and Communications 3 2005
1120693805;Computational Intelligence;Computational Intelligence 32 2016
1161697372;Wireless Personal Multimedia Communications;Wireless Personal Multimedia Communications 94 2011
1179107595;European Conference on Artificial Life;European Conference on Artificial Life 2801 2003
1146687534;Pacific Rim Conference on Multimedia;Pacific Rim Conference on Multimedia 2195 2001
1179408524;Emerging Technologies and Factory Automation;Emerging Technologies and Factory Automation 1 2005
2755646922;Joint Pattern Recognition Symposium;Joint Pattern Recognition Symposium 2449 2002
1199829186;Programming Multi-Agent Systems;Programming Multi-Agent Systems 3067 2003
1177774579;Next Generation Internet;Next Generation Internet 4396 2006
1165285842;International Conference on Database Theory;International Conference on Database Theory 116 1990
1166230065;Formal Methods in Computer-Aided Design;Formal Methods in Computer-Aided Design 1954 2000
1171708086;Ubiquitous Computing Systems;Ubiquitous Computing Systems 4239 2006
1141405744;Grid and Pervasive Computing;Grid and Pervasive Computing 6104 2010
1165458643;Artificial Intelligence and Computational Intelligence;Artificial Intelligence and Computational Intelligence 5855 2009
2754362256;Eurographics;Eurographics 34 2015
2898576462;International Conference Hybrid Intelligent Systems;International Conference Hybrid Intelligent Systems 4 2004
1191753779;International Parallel and Distributed Processing Symposium;International Parallel and Distributed Processing Symposium 13 2001
2624559037;Midwest Symposium on Circuits and Systems;Midwest Symposium on Circuits and Systems 3 2002
1136783206;International Conference on Parallel and Distributed Systems;International Conference on Parallel and Distributed Systems 2 2005
1140449422;International Joint Conference on Neural Network;International Joint Conference on Neural Network 2 1999
1179008804;Software Technologies for Embedded and Ubiquitous Systems;Software Technologies for Embedded and Ubiquitous Systems 5860 2009
1154752525;Ubiquitous Intelligence and Computing;Ubiquitous Intelligence and Computing 5585 2009
1145863690;Distributed Multimedia Systems;Distributed Multimedia Systems 1309 1997
1132290396;International Conference on Innovative Computing, Information and Control;International Conference on Innovative Computing, Information and Control 2 2006
1133691915;Asia Pacific Conference on Circuits and Systems;Asia Pacific Conference on Circuits and Systems 2 2002
1193731136;Educational Data Mining;Educational Data Mining 2012 2012
2759893951;Algorithmic Number Theory Symposium;Algorithmic Number Theory Symposium 6197 2010
1145089474;International Conference on Telecommunications;International Conference on Telecommunications 2 2003
1187330200;Advanced Information Networking and Applications;Advanced Information Networking and Applications 1 2005
2622776580;International Conference on Wireless Communications, Networking and Mobile Computing;International Conference on Wireless Communications, Networking and Mobile Computing 1 2005
1199147270;Non-Linear Speech Processing;Non-Linear Speech Processing 3817 2005
2758341742;International Conference on Complex Sciences;International Conference on Complex Sciences 4 2009
2758346301;Abstract State Machines, Alloy, B and Z;Abstract State Machines, Alloy, B and Z 5977 2010
2756328140;IEEE Nuclear Science Symposium;IEEE Nuclear Science Symposium 3 2002
2754677800;International Conference on Structural Information and Communication Complexity;International Conference on Structural Information and Communication Complexity 7355 2012
1163887669;Natural Language Generation;Natural Language Generation 24 1998
