conference_id;name;publication
2759168861;International Conference on Progress in Cryptology;International Conference on Progress in Cryptology 7533 2012
1130566378;Research Challenges in Information Science;Research Challenges in Information Science 4 2007
1164975091;International Conference on Computer Vision;International Conference on Computer Vision 24 2008
2755724983;International Conference on Human Haptic Sensing and Touch Enabled Computer Applications;International Conference on Human Haptic Sensing and Touch Enabled Computer Applications 8619 2014
2754197539;International Conference on Agile Software Development;International Conference on Agile Software Development 111 2012
2757487807;American Medical Informatics Association Annual Symposium;American Medical Informatics Association Annual Symposium 2008 2008
1174248916;Pacific Rim International Conference on Artificial Intelligence;Pacific Rim International Conference on Artificial Intelligence 8862 2014
2757804692;Joint Conference on Lexical and Computational Semantics;Joint Conference on Lexical and Computational Semantics 1 2012
1180662882;International Conference on Machine Learning;International Conference on Machine Learning 32 2014
1179702818;Active Media Technology;Active Media Technology 138 2006
1137640971;Italian Workshop on Neural Nets;Italian Workshop on Neural Nets 26 2014
1184914352;National Conference on Artificial Intelligence;National Conference on Artificial Intelligence 2 2007
1139274412;International Conference on Image Analysis and Processing;International Conference on Image Analysis and Processing 8158 2013
1127419992;International Conference on Human-Computer Interaction;International Conference on Human-Computer Interaction 6762 2011
1134804816;International Conference on Interactive Digital Storytelling;International Conference on Interactive Digital Storytelling 7648 2012
1191550517;Model Driven Engineering Languages and Systems;Model Driven Engineering Languages and Systems 8107 2013
1130177464;Symposium on Discrete Algorithms;Symposium on Discrete Algorithms 12 2016
1129324708;Medical Image Computing and Computer-Assisted Intervention;Medical Image Computing and Computer-Assisted Intervention 14 2011
1184527398;Language and Automata Theory and Applications;Language and Automata Theory and Applications 6638 2011
2756208608;DepCoS-RELCOMEX;DepCoS-RELCOMEX 224 2013
1187792334;Cellular Automata for Research and Industry;Cellular Automata for Research and Industry 7495 2012
2754492142;International Computer Music Conference;International Computer Music Conference 2005 2005
2757021987;Medicine Meets Virtual Reality;Medicine Meets Virtual Reality 142 2009
1182309694;Decision Support Systems;Decision Support Systems 22 1998
1163686456;Mathematical Foundations of Computer Science;Mathematical Foundations of Computer Science 7464 2012
1188726732;Applied Reconfigurable Computing;Applied Reconfigurable Computing 7199 2012
1136791909;Logical Aspects of Computational Linguistics;Logical Aspects of Computational Linguistics 7351 2012
1119602113;Workshop on Algorithms in Bioinformatics;Workshop on Algorithms in Bioinformatics 8701 2014
1160491194;Provable Security;Provable Security 8782 2014
1195648157;Conference on Current Trends in Theory and Practice of Informatics;Conference on Current Trends in Theory and Practice of Informatics 7147 2012
2755314191;European conference on Machine Learning;European conference on Machine Learning 6911 2011
1140213147;Theory and Application of Cryptographic Techniques;Theory and Application of Cryptographic Techniques 7881 2013
2754283107;Conference on Biomimetic and Biohybrid Systems;Conference on Biomimetic and Biohybrid Systems 8064 2013
2756998668;Business Process Modeling, Development and Support;Business Process Modeling, Development and Support 81 2011
1130873268;Information Processing in Medical Imaging;Information Processing in Medical Imaging 22 2011
1130677785;Mobile and Wireless Communication Networks;Mobile and Wireless Communication Networks 211 2006
1120715160;High Performance Embedded Architectures and Compilers;High Performance Embedded Architectures and Compilers 4 2011
1160834642;Geographic Information Science;Geographic Information Science 8728 2014
1180338098;European Conference on Software Architecture;European Conference on Software Architecture 7957 2013
1158833223;International Conference on Artificial Neural Networks;International Conference on Artificial Neural Networks 7902 2013
2755498524;Australasian Joint Conference on Artificial Intelligence;Australasian Joint Conference on Artificial Intelligence 7106 2011
1191904734;International Conference on Computational Science and Its Applications;International Conference on Computational Science and Its Applications 6782 2011
1134467612;Discrete Geometry for Computer Imagery;Discrete Geometry for Computer Imagery 7749 2013
1162831978;European Conference on Artificial Intelligence;European Conference on Artificial Intelligence 178 2008
1151763769;International Conference on Enterprise Information Systems;International Conference on Enterprise Information Systems 2 2010
2758465625;Descriptional Complexity of Formal Systems;Descriptional Complexity of Formal Systems 7386 2012
2756314553;Trans. Computational Collective Intelligence;Trans. Computational Collective Intelligence 9 2013
2898361526;International Workshop Description Logics;International Workshop Description Logics 477 2009
1203999783;International Joint Conference on Artificial Intelligence;International Joint Conference on Artificial Intelligence 6814 2011
1177515820;String Processing and Information Retrieval;String Processing and Information Retrieval 7608 2012
2898322738;Nordic Workshop Programming Theory;Nordic Workshop Programming Theory 13 2006
1128002137;Data Warehousing and Knowledge Discovery;Data Warehousing and Knowledge Discovery 8646 2014
1122827389;Job Scheduling Strategies for Parallel Processing;Job Scheduling Strategies for Parallel Processing 2862 2003
2756014376;International Conference on Universal Access in Human-Computer Interaction;International Conference on Universal Access in Human-Computer Interaction 8010 2013
1151131449;Computer Science and Software Engineering;Computer Science and Software Engineering 5 2005
2606075370;Robotics: Science and Systems;Robotics: Science and Systems 3 2007
2754805320;International Conference on Digital Forensics;International Conference on Digital Forensics 410 2013
1178070762;Symposium on Theoretical Aspects of Computer Science;Symposium on Theoretical Aspects of Computer Science 4393 2007
1140680567;Intelligent Systems in Molecular Biology;Intelligent Systems in Molecular Biology 5 1997
2756018882;International Conference on Exploring Services Science;International Conference on Exploring Services Science 143 2013
1176128511;Medical Informatics Europe;Medical Informatics Europe 150 2009
1142381819;Text, Speech and Dialogue;Text, Speech and Dialogue 8082 2013
2898320085;Workshop Artificial Life and Evolutionary Computation;Workshop Artificial Life and Evolutionary Computation 445 2014
1119897178;Simulated Evolution and Learning;Simulated Evolution and Learning 8886 2014
2755747537;Joint IFIP Wireless and Mobile Networking Conference;Joint IFIP Wireless and Mobile Networking Conference 308 2009
2754563871;International Conference on Implementation and application of automata;International Conference on Implementation and application of automata 26 2014
1128202388;Web Information Systems Engineering;Web Information Systems Engineering 7651 2012
1183679797;European Symposium on Research in Computer Security;European Symposium on Research in Computer Security 7459 2012
1160783667;Granular Computing;Granular Computing 8170 2013
1192038392;Learning and Intelligent Optimization;Learning and Intelligent Optimization 6683 2011
1163286138;Developments in Language Theory;Developments in Language Theory 6795 2011
2756860364;Uncertainty Reasoning for the Semantic Web;Uncertainty Reasoning for the Semantic Web 327 2007
1127759574;Artificial Intelligence in Medicine in Europe;Artificial Intelligence in Medicine in Europe 6747 2011
1190735678;Web Services and Formal Methods;Web Services and Formal Methods 8379 2013
1143948298;Pacific-Rim Symposium on Image and Video Technology;Pacific-Rim Symposium on Image and Video Technology 7087 2011
1129385027;International Conference on Information Systems Security;International Conference on Information Systems Security 7671 2012
1139135573;Algorithmic Aspects of Wireless Sensor Networks;Algorithmic Aspects of Wireless Sensor Networks 9536 2015
1187637167;Advanced Concepts for Intelligent Vision Systems;Advanced Concepts for Intelligent Vision Systems 3708 2005
1180241966;International Conference on Smart Homes and Health Telematics;International Conference on Smart Homes and Health Telematics 7251 2012
1183580825;International Conference on Neural Information Processing;International Conference on Neural Information Processing 8227 2013
2760054250;Processing of the Portuguese Language;Processing of the Portuguese Language 7243 2012
1186729694;International Conference on Web Engineering;International Conference on Web Engineering 7059 2011
1194640161;Principles of Security and Trust;Principles of Security and Trust 8414 2014
1163494139;Workshop on Internet and Network Economics;Workshop on Internet and Network Economics 8877 2014
2758937542;Formal Aspects in Security and Trust;Formal Aspects in Security and Trust 7140 2011
1136861413;European Symposium on Programming;European Symposium on Programming 7211 2012
1137413041;International Symposium on Functional and Logic Programming;International Symposium on Functional and Logic Programming 7294 2012
2756349628;International Conference of Design, User Experience, and Usability;International Conference of Design, User Experience, and Usability 11 2014
2760555016;Multiple Access Communications;Multiple Access Communications 8715 2014
1184699546;Database Systems for Advanced Applications;Database Systems for Advanced Applications 8421 2014
2755269626;IFIP World Computer Congress - WCC;IFIP World Computer Congress - WCC 1 2010
1201250571;Intelligent Data Analysis;Intelligent Data Analysis 15 2011
1123077274;Soft Computing;Soft Computing 17 2013
1146416605;Trust and Privacy in Digital Business;Trust and Privacy in Digital Business 8058 2013
2238538125;American Control Conference;American Control Conference 2 2004
1203333039;Distributed Computing and Artificial Intelligence;Distributed Computing and Artificial Intelligence 217 2013
2754386153;ACM/IFIP/USENIX international conference on Middleware;ACM/IFIP/USENIX international conference on Middleware 7049 2011
1158589615;International Conference on Service Oriented Computing;International Conference on Service Oriented Computing 7084 2011
1200891582;Computational Models of Argument;Computational Models of Argument 216 2010
1200979010;International Conference on Agents and Artificial Intelligence;International Conference on Agents and Artificial Intelligence 2 2012
1192804102;Combinatorial Pattern Matching;Combinatorial Pattern Matching 6661 2011
1171345118;Ubiquitous Computing;Ubiquitous Computing 151 2011
2754803852;World Conference on Information Systems and Technologies;World Conference on Information Systems and Technologies 206 2013
1172647307;Enterprise Engineering Working Conference;Enterprise Engineering Working Conference 146 2013
1137552346;Static Analysis Symposium;Static Analysis Symposium 8723 2014
1178622071;Grid Computing;Grid Computing 12 2004
1188030315;International Conference on Software and Data Technologies;International Conference on Software and Data Technologies 303 2011
1155608529;International Semantic Web Conference;International Semantic Web Conference 6496 2010
1182313844;International Conference on Image Analysis and Recognition;International Conference on Image Analysis and Recognition 8814 2014
1150638746;International Conference on Software Business;International Conference on Software Business 150 2013
1162100051;Product Focused Software Process Improvement;Product Focused Software Process Improvement 6759 2011
2754601805;Chinese conference on Biometric Recognition;Chinese conference on Biometric Recognition 3338 2004
1130985203;Knowledge Discovery and Data Mining;Knowledge Discovery and Data Mining 7867 2013
1201491352;Principles and Practice of Constraint Programming;Principles and Practice of Constraint Programming 6876 2011
1138890651;Symposium on Experimental and Efficient Algorithms;Symposium on Experimental and Efficient Algorithms 7933 2013
1127098075;Cryptographic Hardware and Embedded Systems;Cryptographic Hardware and Embedded Systems 7428 2012
1148878455;Business Information Systems;Business Information Systems 97 2011
2755198924;Digital Games Research Association Conference;Digital Games Research Association Conference 7 2013
1128819360;Web Reasoning and Rule Systems;Web Reasoning and Rule Systems 8741 2014
1184269240;Power and Timing Modeling, Optimization and Simulation;Power and Timing Modeling, Optimization and Simulation 6951 2011
2898215259;International Conference Information Processing;International Conference Information Processing 299 2012
1170788073;Working Conference on Virtual Enterprises;Working Conference on Virtual Enterprises 408 2013
1153524033;International Cryptology Conference;International Cryptology Conference 8617 2014
1180003657;European Semantic Web Conference;European Semantic Web Conference 8465 2014
1155899826;International Conference on Parallel Processing;International Conference on Parallel Processing 8385 2013
2759125792;International SPIN conference on Model checking software;International SPIN conference on Model checking software 4595 2007
1158363782;Networked Systems Design and Implementation;Networked Systems Design and Implementation 2013 2013
2756046938;International Conference on Scale Space and Variational Methods in computer vision;International Conference on Scale Space and Variational Methods in computer vision 7893 2013
1172886419;International Conference of Distributed Computing and Networking;International Conference of Distributed Computing and Networking 7129 2012
2755126985;International Conference on Digital Mammography;International Conference on Digital Mammography 6136 2010
1163280044;Flexible Query Answering Systems;Flexible Query Answering Systems 8132 2013
1171980720;Scandinavian Conference on Image Analysis;Scandinavian Conference on Image Analysis 7944 2013
2757484200;Multiple Classifier Systems;Multiple Classifier Systems 7872 2013
2539392191;International Conference on Embedded Wireless Systems and Networks;International Conference on Embedded Wireless Systems and Networks 7158 2012
1141157497;International Conference on Coordination Models and Languages;International Conference on Coordination Models and Languages 8459 2014
1180513217;European Conference on Information Retrieval;European Conference on Information Retrieval 8416 2014
2759122327;Practical Applications of Agents and Multi-Agent Systems;Practical Applications of Agents and Multi-Agent Systems 8473 2014
1154921601;Scalable Uncertainty Management;Scalable Uncertainty Management 61 2019
1139297330;Asian Symposium on Programming Languages and Systems;Asian Symposium on Programming Languages and Systems 7705 2012
2757226066;International Symposium on Stabilization, Safety, and Security of Distributed Systems;International Symposium on Stabilization, Safety, and Security of Distributed Systems 8756 2014
2759848371;International conference on Datalog in Academia and Industry;International conference on Datalog in Academia and Industry 7494 2012
2755319328;International IFIP-TC Networking Conference;International IFIP-TC Networking Conference 2 2012
2755653720;Extended Semantic Web Conference;Extended Semantic Web Conference 7882 2013
1119484956;Simulation of Adaptive Behavior;Simulation of Adaptive Behavior 7426 2012
1150140640;International Conference on Computational Collective Intelligence;International Conference on Computational Collective Intelligence 8083 2013
2760694600;The Cryptographers’ Track at the RSA Conference;The Cryptographers’ Track at the RSA Conference 2964 2004
1188071776;Conference on Algebra and Coalgebra in Computer Science;Conference on Algebra and Coalgebra in Computer Science 8089 2013
1176514135;International Conference on Conceptual Modeling;International Conference on Conceptual Modeling 8823 2014
2755458412;International Conference on Evolutionary Multi-criterion Optimization;International Conference on Evolutionary Multi-criterion Optimization 1993 2001
1178880552;International Workshop on Ambient Assisted Living;International Workshop on Ambient Assisted Living 7657 2012
1171876160;Cryptology and Network Security;Cryptology and Network Security 5339 2008
2760006162;International Workshop on Reachability Problems;International Workshop on Reachability Problems 8169 2013
2754698934;International Conference on Trust Management;International Conference on Trust Management 401 2013
2755428484;International Conference on Software Process Improvement and Capability Determination;International Conference on Software Process Improvement and Capability Determination 155 2011
2756090654;Trans. Computational Science;Trans. Computational Science 21 2013
2755531268;Conference Towards Autonomous Robotic Systems;Conference Towards Autonomous Robotic Systems 8717 2014
2757131477;International Conference on Cryptology in Africa;International Conference on Cryptology in Africa 7374 2012
2755058989;Joint International Conference on Information Sciences;Joint International Conference on Information Sciences 52 2011
1204434967;Applications and Theory of Petri Nets;Applications and Theory of Petri Nets 8489 2014
2758995940;Electronic Government and the Information Systems Perspective;Electronic Government and the Information Systems Perspective 8061 2013
1132773841;Workshop on Algorithms and Computation;Workshop on Algorithms and Computation 123 2017
1192664773;Database and Expert Systems Applications;Database and Expert Systems Applications 7447 2012
1124077590;European Conference on Computer Vision;European Conference on Computer Vision 7577 2012
1177287137;Conference of the International Speech Communication Association;Conference of the International Speech Communication Association 3 2001
2735555832;International Conference on Information and Communication Technology;International Conference on Information and Communication Technology 7804 2013
1162450063;Computer Aided Verification;Computer Aided Verification 7358 2012
1146669736;Worst-Case Execution Time Analysis;Worst-Case Execution Time Analysis 23 2012
1168863100;The Internet of Things;The Internet of Things 8121 2013
1156741871;International Symposium on Bioinformatics Research and Applications;International Symposium on Bioinformatics Research and Applications 7875 2013
1169227017;Conference On Spatial Information Theory;Conference On Spatial Information Theory 8116 2013
1168666102;International Conference on Case-Based Reasoning;International Conference on Case-Based Reasoning 7466 2012
1154039276;European Symposium on Algorithms;European Symposium on Algorithms 638 2012
1140657324;International Conference on Computational Logistics;International Conference on Computational Logistics 6971 2011
1160224924;International Symposium on Memory Management;International Symposium on Memory Management 30 2005
1175705186;International Symposium on Visual Computing;International Symposium on Visual Computing 8888 2014
1201110412;International Conference on Logic Programming;International Conference on Logic Programming 5366 2008
2622962978;International Conference on Artificial Intelligence and Statistics;International Conference on Artificial Intelligence and Statistics 33 2014
2756297237;International Conference on Haptic and Audio Interaction Design;International Conference on Haptic and Audio Interaction Design 6851 2011
1184106476;Advanced Data Mining and Applications;Advanced Data Mining and Applications 7121 2011
1169674987;International Conference on Computational Linguistics;International Conference on Computational Linguistics 7816 2013
2754249383;International Conference on Information Security;International Conference on Information Security 7001 2011
2758123139;Selected Areas in Cryptography;Selected Areas in Cryptography 3006 2003
1136953354;Workshop on Algorithms and Models for the Web-Graph;Workshop on Algorithms and Models for the Web-Graph 12 2016
1164203406;Workshop on Recent Trends in Algebraic Development Techniques;Workshop on Recent Trends in Algebraic Development Techniques 7841 2012
2759880100;Information Security Conference;Information Security Conference 376 2012
2757670379;USENIX conference on Hot Topics in Cloud Ccomputing;USENIX conference on Hot Topics in Cloud Ccomputing 2012 2012
1147859159;International Conference on Networking;International Conference on Networking 6827 2011
2607379586;Intelligent Tutoring Systems;Intelligent Tutoring Systems 8474 2014
2533150121;Public Key Cryptography;Public Key Cryptography 8383 2014
1174168622;Knowledge and Systems Engineering;Knowledge and Systems Engineering 2 2014
2754002042;International Conference on Foundations of Augmented Cognition;International Conference on Foundations of Augmented Cognition 6780 2011
1183852906;Theorem Proving with Analytic Tableaux and Related Methods;Theorem Proving with Analytic Tableaux and Related Methods 6793 2011
1174403976;International Conference on Software Engineering;International Conference on Software Engineering 7504 2012
2754339667;International Conference on Engineering Psychology and Cognitive Ergonomics;International Conference on Engineering Psychology and Cognitive Ergonomics 6781 2011
1146600191;Foundations of Software Science and Computation Structure;Foundations of Software Science and Computation Structure 2987 2004
2758740029;Congress of the Italian Association for Artificial Intelligence;Congress of the Italian Association for Artificial Intelligence 8249 2013
1120209348;Rewriting Techniques and Applications;Rewriting Techniques and Applications 8560 2014
1133495350;International Conference on Distributed Computing and Internet Technology;International Conference on Distributed Computing and Internet Technology 8337 2014
2755570506;International Conference on Membrane Computing;International Conference on Membrane Computing 7762 2012
2757049256;Leveraging Applications of Formal Methods;Leveraging Applications of Formal Methods 7609 2012
1200543359;Runtime Verification;Runtime Verification 55 2001
2754378120;International Conference on Social Robotics;International Conference on Social Robotics 2011 2011
1140082307;Asia-Pacific Web Conference;Asia-Pacific Web Conference 7235 2012
1188739475;Meeting of the Association for Computational Linguistics;Meeting of the Association for Computational Linguistics 5 2010
1204638610;International Conference on Asian Digital Libraries;International Conference on Asian Digital Libraries 2555 2002
1194005070;Aspect-Oriented Software Development;Aspect-Oriented Software Development 11 2014
1131830996;Australasian Conference on Information Security and Privacy;Australasian Conference on Information Security and Privacy 8544 2014
1193534515;International Conference on Computer Supported Education;International Conference on Computer Supported Education 1 2014
1150208541;Foundations of Computer Science;Foundations of Computer Science 6662 2010
2755786043;International Conference on Industrial Applications of Holonic and Multi-Agent Systems;International Conference on Industrial Applications of Holonic and Multi-Agent Systems 6867 2011
2758847462;High Performance Computing Symposium;High Performance Computing Symposium 45 2013
1170695740;Systems, Man and Cybernetics;Systems, Man and Cybernetics 1 1998
1121242901;International Colloquium on Theoretical Aspects of Computing;International Colloquium on Theoretical Aspects of Computing 8687 2014
1168262657;Italian Research Conference on Digital Library Management Systems;Italian Research Conference on Digital Library Management Systems 249 2011
2758506058;International Symposium on Ambient Intelligence;International Symposium on Ambient Intelligence 92 2011
1161953916;European Conference on Technology Enhanced Learning;European Conference on Technology Enhanced Learning 6964 2011
1165293657;Agent and Multi-Agent Systems: Technologies and Applications;Agent and Multi-Agent Systems: Technologies and Applications 7327 2012
1166878115;Deontic Logic in Computer Science;Deontic Logic in Computer Science 7393 2012
2755283090;International Conference on Artificial Intelligence;International Conference on Artificial Intelligence 6934 2011
1161424158;International Symposium on Neural Networks;International Symposium on Neural Networks 8866 2014
1204606053;Uncertainty in Artificial Intelligence;Uncertainty in Artificial Intelligence 30 2014
1155746833;Knowledge Science, Engineering and Management;Knowledge Science, Engineering and Management 8793 2014
1134069326;Conference on Advanced Information Systems Engineering;Conference on Advanced Information Systems Engineering 148 2013
1153395238;International Conference on Web-Based Learning;International Conference on Web-Based Learning 4181 2006
1130464007;Automated Technology for Verification and Analysis;Automated Technology for Verification and Analysis 8172 2013
1169806927;Formal Methods;Formal Methods 3 1992
2898326963;International Conference Computer Science and Applied Mathematics;International Conference Computer Science and Applied Mathematics 282 2014
